{
  "artifact_type": "assurance-report",
  "disposition": "PASS",
  "evidence_refs": [
    "repo/evidence/design-readiness/build-manifest.json",
    "repo/evidence/design-readiness/build-conformance.json",
    "repo/planning/evidence/design-readiness/planning-acceptance.json"
  ],
  "findings": [],
  "phase": "Build",
  "rationale": "Semantic review confirms the realization is faithful to the accepted Design Readiness Plan: it adds Design as an acceptance stage while preserving existing Conformance, Assurance, authorization, evidence, and non-circularity boundaries.",
  "schema_version": "1",
  "subject_id": "DESIGN-READINESS-BUILD"
}
