{
  "artifact_type": "assurance-report",
  "disposition": "PASS",
  "evidence_refs": [
    "repo/planning/001_DESIGN-READINESS/functional-set.json",
    "repo/planning/001_DESIGN-READINESS/plan.json",
    "repo/planning/evidence/design-readiness/planning-conformance.json"
  ],
  "findings": [],
  "phase": "Planning",
  "rationale": "Semantic review confirms Design Readiness is a bounded first successor slice: it realizes explicit Design-stage acceptance already defined by selected Design, reuses FS0 Conformance/Assurance/Governance primitives, and introduces no new authority domain or hidden semantic-review behavior.",
  "schema_version": "1",
  "subject_id": "DESIGN-READINESS-PLAN"
}
